{
  "executionId": "exec-20240601-001",
  "taskId": "task-01",
  "agentId": "agent-01",
  "startTime": "2025-06-28T10:20:00Z",
  "endTime": "2025-06-28T10:22:45Z",
  "status": "success",
  "input": {
    "query": "multi-agent reinforcement learning site:arxiv.org"
  },
  "output": {
    "results": [
      {
        "title": "Cooperative Multi-Agent Reinforcement Learning",
        "url": "https://arxiv.org/abs/1234.56789"
      },
      {
        "title": "A Survey on Multi-Agent Learning",
        "url": "https://arxiv.org/abs/9876.54321"
      }
    ]
  },
  "tool": {
    "name": "WebSearch",
    "version": "1.2.0",
    "endpoint": "searchEngine.query"
  },
  "error": ""
}